{"schemaVersion":"1.1.0","locus":"btk","interval":{"chromosome":"chrX","start":100861936,"end":101910512},"provenance":{"source":"atlas-api","clientVersion":"0.9.0","pipelineVersion":"0.1.0","queriedAt":"2026-09-12T19:27:09Z","configHash":"e06f40c9e068ccc3","calibrationEpoch":"quantiles>=2026-06-18,indels>=2026-07-14","notes":"Genes y exones de Ensembl REST, GRCh38. No es una prediccion."},"genes":[{"name":"NOX1","strand":"-","start":100843323,"end":100874464,"transcripts":[]},{"name":"XKRX","strand":"-","start":100886923,"end":100929433,"transcripts":[]},{"name":"ARL13A","strand":"+","start":100969707,"end":100990831,"transcripts":[]},{"name":"TRMT2B","strand":"-","start":100973669,"end":101052135,"transcripts":[]},{"name":"TRMT2B-AS1","strand":"-","start":101043563,"end":101094476,"transcripts":[]},{"name":"TMEM35A","strand":"+","start":101078869,"end":101096367,"transcripts":[]},{"name":"CENPI","strand":"+","start":101098149,"end":101166126,"transcripts":[]},{"name":"DRP2","strand":"+","start":101219722,"end":101264502,"transcripts":[{"id":"ENST00000402866","exons":[[101219768,101219905],[101220078,101220146],[101231584,101231764],[101235859,101236023],[101237618,101237775],[101238980,101239101],[101241667,101241936],[101242324,101242471],[101242903,101242982],[101245016,101245077],[101245387,101245449],[101247089,101247164],[101248088,101248290],[101248513,101248599],[101250422,101250580],[101250916,101251083],[101252604,101252716],[101254424,101254561],[101254858,101254924],[101255183,101255249],[101256117,101256261],[101258308,101258546],[101260048,101260169],[101260496,101264502]]},{"id":"ENST00000395209","exons":[[101219785,101220146],[101224603,101224706],[101231584,101231764],[101235859,101236023],[101237618,101237775],[101238980,101239101],[101241667,101241936],[101242324,101242471],[101242903,101242982],[101245016,101245077],[101245387,101245449],[101247089,101247164],[101248088,101248290],[101248513,101248599],[101250422,101250580],[101250916,101251083],[101252604,101252716],[101254424,101254561],[101254858,101254924],[101255183,101255249],[101256117,101256261],[101258308,101258546],[101260048,101260169],[101260496,101264502]]}]},{"name":"TAF7L","strand":"-","start":101268252,"end":101293057,"transcripts":[{"id":"ENST00000372907","exons":[[101268252,101269237],[101275221,101275281],[101275999,101276112],[101276306,101276528],[101277605,101277719],[101278048,101278121],[101278993,101279035],[101281719,101281775],[101282326,101282453],[101283449,101283583],[101286574,101286653],[101287477,101287545],[101292789,101293057]]},{"id":"ENST00000356784","exons":[[101268256,101269237],[101275221,101275281],[101275999,101276112],[101276306,101276528],[101277605,101277719],[101278048,101278121],[101278993,101279035],[101281719,101281775],[101282326,101282453],[101283449,101283583],[101286574,101286653],[101287477,101287545],[101291223,101291334]]}]},{"name":"TIMM8A","strand":"-","start":101320049,"end":101349001,"transcripts":[{"id":"ENST00001006678","exons":[[101320049,101321210],[101346469,101346660],[101348532,101349001]]},{"id":"ENST00001104699","exons":[[101341051,101341350],[101346469,101346660],[101348532,101349001]]}]},{"name":"RNU6-934P","strand":"+","start":101325403,"end":101325510,"transcripts":[{"id":"ENST00000365154","exons":[[101325403,101325510]]}]},{"name":"BTK","strand":"-","start":101349337,"end":101390796,"transcripts":[{"id":"ENST00000695615","exons":[[101349337,101349956],[101353193,101353351],[101353869,101353988],[101354629,101354694],[101356051,101356268],[101356783,101356955],[101357508,101357583],[101358309,101358437],[101358616,101358696],[101359292,101359347],[101360087,101360150],[101360567,101360755],[101362172,101362240],[101362560,101362689],[101369997,101370079],[101371632,101371701],[101374535,101374634],[101375143,101375314],[101375594,101375659],[101386061,101386182]]},{"id":"ENST00000695614","exons":[[101349337,101349956],[101353193,101353351],[101353869,101353988],[101354629,101354694],[101356051,101356268],[101356783,101356955],[101357508,101357583],[101358309,101358437],[101358616,101358696],[101359292,101359347],[101360087,101360150],[101360567,101360755],[101362172,101362240],[101362560,101362689],[101369997,101370079],[101371632,101371701],[101374535,101374634],[101375143,101375296],[101386061,101386180]]}]},{"name":"RPL36A","strand":"+","start":101390823,"end":101396155,"transcripts":[{"id":"ENST00000427805","exons":[[101390823,101391046],[101391458,101391564],[101391754,101391822],[101395334,101395457],[101395727,101396155]]},{"id":"ENST00000553110","exons":[[101391010,101391046],[101391458,101391564],[101391754,101391822],[101395334,101395457],[101395727,101396155]]}]},{"name":"RPL36A-HNRNPH2","strand":"+","start":101391010,"end":101412297,"transcripts":[{"id":"ENST00000409170","exons":[[101391011,101391046],[101391458,101391564],[101391754,101391822],[101395334,101395457],[101411935,101412165]]},{"id":"ENST00000409338","exons":[[101391010,101391046],[101391458,101391564],[101391754,101391822],[101411935,101412297]]}]},{"name":"GLA","strand":"-","start":101393272,"end":101408012,"transcripts":[{"id":"ENST00000710365","exons":[[101397452,101398099],[101398369,101398567],[101398784,101398946],[101400665,101400757],[101401631,101401809],[101403810,101403985],[101405158,101405233],[101407709,101407925]]},{"id":"ENST00000649178","exons":[[101397452,101398099],[101398369,101398567],[101398784,101398946],[101400665,101400757],[101401631,101401809],[101403810,101403985],[101405110,101405233],[101407709,101407925]]}]},{"name":"HNRNPH2","strand":"+","start":101408113,"end":101414778,"transcripts":[{"id":"ENST00000942885","exons":[[101408198,101408319],[101410495,101410575],[101411935,101414778]]},{"id":"ENST00000942886","exons":[[101408198,101408319],[101411435,101411504],[101411935,101414778]]}]},{"name":"ARMCX4","strand":"+","start":101418268,"end":101535551,"transcripts":[{"id":"ENST00000423738","exons":[[101485455,101485530],[101486022,101486092],[101487192,101487272],[101487607,101487691],[101488043,101488099],[101488443,101495807]]}]},{"name":"ARMCX1","strand":"+","start":101550410,"end":101554704,"transcripts":[{"id":"ENST00000898860","exons":[[101550410,101550660],[101550970,101551024],[101551568,101551633],[101551876,101551967],[101552444,101552507],[101552808,101554704]]},{"id":"ENST00000936543","exons":[[101550410,101550660],[101550973,101551024],[101551568,101551633],[101551876,101551967],[101552444,101552517],[101552808,101554704]]}]},{"name":"ENSG00000302677","strand":"-","start":101597243,"end":101599486,"transcripts":[]},{"name":"ENSG00000290908","strand":"+","start":101598016,"end":101598671,"transcripts":[{"id":"ENST00000602449","exons":[[101598016,101598671]]}]},{"name":"ARMCX6","strand":"-","start":101615117,"end":101618011,"transcripts":[]},{"name":"ARMCX3","strand":"+","start":101622796,"end":101627843,"transcripts":[]},{"name":"ARMCX3-AS1","strand":"-","start":101622982,"end":101624164,"transcripts":[]},{"name":"ENSG00000261101","strand":"+","start":101627867,"end":101628523,"transcripts":[]},{"name":"RNU6-30P","strand":"-","start":101634005,"end":101634112,"transcripts":[]},{"name":"ENSG00000286000","strand":"+","start":101640420,"end":101644352,"transcripts":[]},{"name":"ENSG00000302702","strand":"-","start":101645148,"end":101645829,"transcripts":[]},{"name":"ARMCX2","strand":"-","start":101654023,"end":101659924,"transcripts":[]},{"name":"ENSG00000302652","strand":"+","start":101658728,"end":101735096,"transcripts":[]},{"name":"RNU6-587P","strand":"+","start":101691579,"end":101691685,"transcripts":[]},{"name":"NXF5","strand":"-","start":101832111,"end":101857577,"transcripts":[]},{"name":"ZMAT1","strand":"-","start":101882287,"end":101932090,"transcripts":[]}]}