{"schemaVersion":"1.0.0","locus":"epas1","interval":{"chromosome":"chr2","start":45815896,"end":46864472},"provenance":{"source":"synthetic","clientVersion":"0.9.0","pipelineVersion":"0.1.0","queriedAt":"2026-09-11T10:46:27Z","configHash":"bd0488843468e63c","calibrationEpoch":"quantiles>=2026-06-18,indels>=2026-07-14","notes":"Fixture sintetica, semilla 0. NO son predicciones."},"genes":[{"name":"EPAS1","strand":"+","start":46253522,"end":46340184,"transcripts":[{"id":"ENST23508863167","exons":[[46257147,46258584],[46259430,46259939],[46266217,46266877],[46267918,46281057],[46285396,46291979],[46298555,46300208]]}]}]}