{"schemaVersion":"1.1.0","locus":"rpl13a","interval":{"chromosome":"chr19","start":48963320,"end":50011896},"provenance":{"source":"atlas-api","clientVersion":"0.9.0","pipelineVersion":"0.1.0","queriedAt":"2026-09-11T13:01:41Z","configHash":"971b320400e9454a","calibrationEpoch":"quantiles>=2026-06-18,indels>=2026-07-14","notes":"Genes y exones de Ensembl REST, GRCh38. No es una prediccion."},"genes":[{"name":"ENSG00000305635","strand":"-","start":48949932,"end":48965953,"transcripts":[]},{"name":"ENSG00000267898","strand":"+","start":48963947,"end":48965158,"transcripts":[]},{"name":"FTL","strand":"+","start":48965274,"end":48967896,"transcripts":[]},{"name":"GYS1","strand":"-","start":48968124,"end":48993349,"transcripts":[]},{"name":"RUVBL2","strand":"+","start":48993475,"end":49017868,"transcripts":[]},{"name":"MIR6798","strand":"+","start":49009905,"end":49009972,"transcripts":[]},{"name":"LHB","strand":"-","start":49015979,"end":49017091,"transcripts":[]},{"name":"SAXO3","strand":"-","start":49017967,"end":49020549,"transcripts":[]},{"name":"CGB3","strand":"-","start":49022868,"end":49024360,"transcripts":[]},{"name":"ENSG00000267335","strand":"-","start":49022952,"end":49036895,"transcripts":[]},{"name":"CGB2","strand":"+","start":49031889,"end":49033238,"transcripts":[]},{"name":"CGB1","strand":"-","start":49035568,"end":49036895,"transcripts":[]},{"name":"CGB5","strand":"+","start":49043594,"end":49045312,"transcripts":[]},{"name":"CGB8","strand":"-","start":49047637,"end":49049125,"transcripts":[]},{"name":"ENSG00000299502","strand":"-","start":49049911,"end":49050538,"transcripts":[]},{"name":"CGB7","strand":"-","start":49054273,"end":49058860,"transcripts":[]},{"name":"ENSG00000283663","strand":"-","start":49055792,"end":49065076,"transcripts":[]},{"name":"ENSG00000268108","strand":"+","start":49060612,"end":49061132,"transcripts":[]},{"name":"NTF4","strand":"-","start":49061065,"end":49065076,"transcripts":[]},{"name":"ENSG00000268287","strand":"+","start":49064258,"end":49064856,"transcripts":[]},{"name":"KCNA7","strand":"-","start":49067396,"end":49072702,"transcripts":[]},{"name":"SNRNP70","strand":"+","start":49085163,"end":49108618,"transcripts":[]},{"name":"ENSG00000297778","strand":"-","start":49108057,"end":49127605,"transcripts":[]},{"name":"LIN7B","strand":"+","start":49114323,"end":49118463,"transcripts":[]},{"name":"C19orf73","strand":"-","start":49118401,"end":49119143,"transcripts":[]},{"name":"PPFIA3","strand":"+","start":49119400,"end":49151027,"transcripts":[]},{"name":"HRC","strand":"-","start":49151013,"end":49155441,"transcripts":[]},{"name":"TRPM4","strand":"+","start":49157736,"end":49211841,"transcripts":[]},{"name":"ENSG00000273189","strand":"+","start":49474585,"end":49487637,"transcripts":[{"id":"ENST00000595815","exons":[[49474585,49474672],[49475673,49475801],[49476144,49476198],[49476422,49476566],[49478908,49479047],[49480297,49480476],[49480551,49480620],[49487016,49487637]]}]},{"name":"RPL13A","strand":"+","start":49487509,"end":49493057,"transcripts":[{"id":"ENST00000679106","exons":[[49487509,49487644],[49489849,49489922],[49490231,49490297],[49490474,49490576],[49490778,49490864],[49491039,49491099],[49491424,49491547],[49491730,49492427]]},{"id":"ENST00000391857","exons":[[49487607,49487644],[49489849,49489922],[49490231,49490297],[49490474,49490576],[49490778,49490864],[49491039,49491099],[49491424,49491547],[49491728,49492308]]}]},{"name":"SNORD32A","strand":"+","start":49489964,"end":49490048,"transcripts":[{"id":"ENST00000364805","exons":[[49489964,49490048]]}]},{"name":"SNORD33","strand":"+","start":49490614,"end":49490699,"transcripts":[]},{"name":"SNORD34","strand":"+","start":49490903,"end":49490974,"transcripts":[]},{"name":"SNORD35A","strand":"+","start":49491174,"end":49491260,"transcripts":[{"id":"ENST00000363389","exons":[[49491174,49491260]]}]},{"name":"RPS11","strand":"+","start":49496232,"end":49499903,"transcripts":[{"id":"ENST00001105421","exons":[[49496232,49496471],[49497193,49497325],[49497519,49497595],[49497753,49497787],[49497916,49498046],[49499511,49499903]]},{"id":"ENST00000594493","exons":[[49496433,49496471],[49497172,49497325],[49497519,49497595],[49497916,49498046],[49499511,49499903]]}]},{"name":"SNORD35B","strand":"+","start":49497719,"end":49497806,"transcripts":[]},{"name":"MIR150","strand":"-","start":49500784,"end":49500868,"transcripts":[{"id":"ENST00000385048","exons":[[49500784,49500868]]}]},{"name":"FCGRT","strand":"+","start":49506805,"end":49526917,"transcripts":[]},{"name":"RCN3","strand":"+","start":49526533,"end":49579703,"transcripts":[]},{"name":"NOSIP","strand":"-","start":49555206,"end":49592927,"transcripts":[]},{"name":"PRRG2","strand":"+","start":49580645,"end":49591004,"transcripts":[]},{"name":"PRR12","strand":"+","start":49591107,"end":49626439,"transcripts":[]},{"name":"ENSG00000268636","strand":"-","start":49625993,"end":49626439,"transcripts":[]},{"name":"RRAS","strand":"-","start":49634554,"end":49640211,"transcripts":[]},{"name":"SCAF1","strand":"+","start":49640487,"end":49658649,"transcripts":[]},{"name":"IRF3","strand":"-","start":49659568,"end":49665864,"transcripts":[]},{"name":"BCL2L12","strand":"+","start":49664621,"end":49673917,"transcripts":[]},{"name":"PRMT1","strand":"+","start":49675785,"end":49689029,"transcripts":[]},{"name":"MIR5088","strand":"+","start":49682116,"end":49682195,"transcripts":[]},{"name":"ENSG00000268677","strand":"-","start":49688852,"end":49690573,"transcripts":[]},{"name":"ADM5","strand":"+","start":49688952,"end":49690575,"transcripts":[]},{"name":"CPT1C","strand":"+","start":49690897,"end":49713733,"transcripts":[]},{"name":"ENSG00000295494","strand":"+","start":49717754,"end":49727482,"transcripts":[]},{"name":"TSKS","strand":"-","start":49739752,"end":49763329,"transcripts":[]},{"name":"ENSG00000309631","strand":"+","start":49763366,"end":49766119,"transcripts":[]},{"name":"RNU6-841P","strand":"-","start":49764523,"end":49764630,"transcripts":[]},{"name":"ENSG00000309651","strand":"-","start":49765428,"end":49766510,"transcripts":[]},{"name":"AP2A1","strand":"+","start":49766911,"end":49807114,"transcripts":[]},{"name":"MIR6799","strand":"+","start":49791865,"end":49791934,"transcripts":[]},{"name":"ENSG00000297022","strand":"-","start":49797345,"end":49802437,"transcripts":[]},{"name":"FUZ","strand":"-","start":49806865,"end":49817376,"transcripts":[]},{"name":"ENSG00000269194","strand":"+","start":49808900,"end":49809844,"transcripts":[]},{"name":"ENSG00000295248","strand":"+","start":49817617,"end":49817959,"transcripts":[]},{"name":"MED25","strand":"+","start":49818268,"end":49840384,"transcripts":[]},{"name":"MIR6800","strand":"+","start":49832017,"end":49832099,"transcripts":[]},{"name":"PTOV1-AS1","strand":"-","start":49838638,"end":49851687,"transcripts":[]},{"name":"PTOV1","strand":"+","start":49850734,"end":49860744,"transcripts":[]},{"name":"ENSG00000268047","strand":"-","start":49852525,"end":49854986,"transcripts":[]},{"name":"MIR4749","strand":"+","start":49854590,"end":49854651,"transcripts":[]},{"name":"PTOV1-AS2","strand":"-","start":49856969,"end":49859289,"transcripts":[]},{"name":"PNKP","strand":"-","start":49859881,"end":49878351,"transcripts":[]},{"name":"AKT1S1","strand":"-","start":49869022,"end":49879470,"transcripts":[]},{"name":"TBC1D17","strand":"+","start":49877500,"end":49888751,"transcripts":[]},{"name":"MIR4750","strand":"+","start":49888174,"end":49888230,"transcripts":[]},{"name":"IL4I1","strand":"-","start":49889653,"end":49929926,"transcripts":[]},{"name":"NUP62","strand":"-","start":49906824,"end":49929926,"transcripts":[]},{"name":"ENSG00000269179","strand":"-","start":49909500,"end":49958391,"transcripts":[]},{"name":"ATF5","strand":"+","start":49923909,"end":49933935,"transcripts":[]},{"name":"MIR4751","strand":"+","start":49933063,"end":49933137,"transcripts":[]},{"name":"SIGLEC11","strand":"-","start":49948909,"end":49961172,"transcripts":[]},{"name":"U3","strand":"-","start":49949315,"end":49949527,"transcripts":[]},{"name":"ENSG00000301908","strand":"-","start":49964664,"end":49972501,"transcripts":[]},{"name":"SIGLEC16","strand":"+","start":49969599,"end":49975819,"transcripts":[]},{"name":"VRK3","strand":"-","start":49974536,"end":50025946,"transcripts":[]}]}