{"schemaVersion":"1.1.0","locus":"ppp1r1a-pde1b","interval":{"chromosome":"chr12","start":54054227,"end":55102803},"provenance":{"source":"atlas-api","clientVersion":"0.9.0","pipelineVersion":"0.1.0","queriedAt":"2026-09-11T12:52:58Z","configHash":"aeffb87bbb3de470","calibrationEpoch":"quantiles>=2026-06-18,indels>=2026-07-14","notes":"Genes y exones de Ensembl REST, GRCh38. No es una prediccion."},"genes":[{"name":"HOXC4","strand":"+","start":54015896,"end":54056030,"transcripts":[]},{"name":"FLJ12825","strand":"+","start":54058139,"end":54122235,"transcripts":[]},{"name":"ENSG00000291180","strand":"-","start":54076837,"end":54082571,"transcripts":[]},{"name":"FAM242C","strand":"-","start":54081913,"end":54147270,"transcripts":[]},{"name":"SMUG1","strand":"-","start":54121276,"end":54189008,"transcripts":[]},{"name":"LINC02381","strand":"+","start":54126018,"end":54147485,"transcripts":[]},{"name":"ENSG00000257534","strand":"-","start":54162064,"end":54164452,"transcripts":[]},{"name":"ENSG00000248576","strand":"+","start":54163138,"end":54168595,"transcripts":[]},{"name":"ENSG00000295945","strand":"+","start":54189070,"end":54190893,"transcripts":[]},{"name":"ENSG00000299945","strand":"-","start":54212950,"end":54216423,"transcripts":[]},{"name":"CBX5","strand":"-","start":54230941,"end":54280141,"transcripts":[]},{"name":"MIR3198-2","strand":"-","start":54231396,"end":54231476,"transcripts":[]},{"name":"SCAT2","strand":"+","start":54262596,"end":54279063,"transcripts":[]},{"name":"ENSG00000258344","strand":"+","start":54276630,"end":54345083,"transcripts":[]},{"name":"ENSG00000289154","strand":"-","start":54278611,"end":54279698,"transcripts":[]},{"name":"HNRNPA1","strand":"+","start":54280192,"end":54287088,"transcripts":[]},{"name":"NFE2","strand":"-","start":54292106,"end":54301259,"transcripts":[]},{"name":"COPZ1","strand":"+","start":54301201,"end":54351848,"transcripts":[]},{"name":"RNU6-950P","strand":"-","start":54317780,"end":54317887,"transcripts":[]},{"name":"MIR148B","strand":"+","start":54337215,"end":54337314,"transcripts":[]},{"name":"ENSG00000289854","strand":"-","start":54347531,"end":54359686,"transcripts":[]},{"name":"GPR84-AS1","strand":"+","start":54352428,"end":54497688,"transcripts":[{"id":"ENST00000795943","exons":[[54391453,54391544],[54407396,54407506],[54408113,54408179],[54427856,54427925],[54436831,54437109]]},{"id":"ENST00000795951","exons":[[54391456,54391544],[54393993,54394081],[54407396,54407506],[54427856,54427925],[54434742,54435295]]}]},{"name":"ENSG00000303642","strand":"+","start":54359369,"end":54360892,"transcripts":[]},{"name":"GPR84","strand":"-","start":54362444,"end":54364493,"transcripts":[]},{"name":"ZNF385A","strand":"-","start":54369128,"end":54391338,"transcripts":[]},{"name":"ITGA5","strand":"-","start":54395260,"end":54419515,"transcripts":[]},{"name":"GTSF1","strand":"-","start":54455949,"end":54473602,"transcripts":[{"id":"ENST00000552397","exons":[[54455953,54456153],[54459088,54459125],[54460376,54460471],[54462108,54462172],[54462641,54462725],[54463170,54463297],[54465066,54465167],[54471232,54471277],[54471759,54472627]]},{"id":"ENST00000305879","exons":[[54455956,54456153],[54459088,54459125],[54460376,54460471],[54462108,54462172],[54462641,54462725],[54463170,54463297],[54465066,54465167],[54471232,54471277],[54473545,54473602]]}]},{"name":"NCKAP1L","strand":"+","start":54497712,"end":54548243,"transcripts":[{"id":"ENST00000293373","exons":[[54497751,54497891],[54499354,54499465],[54500532,54500625],[54507852,54507909],[54508388,54508531],[54509668,54509759],[54509847,54509985],[54511802,54511851],[54511948,54512105],[54516238,54516295],[54516895,54516992],[54517532,54517642],[54517805,54517938],[54518650,54518732],[54518913,54518972],[54519186,54519332],[54520693,54520826],[54521118,54521238],[54523393,54523539],[54523824,54523956],[54526527,54526746],[54528246,54528377],[54531259,54531357],[54531490,54531584],[54531742,54531825],[54532169,54532250],[54535103,54535197],[54536128,54536245],[54536943,54537053],[54538883,54538973],[54542574,54548243]]},{"id":"ENST00000545638","exons":[[54498783,54498835],[54499354,54499465],[54500532,54500625],[54507852,54507909],[54508388,54508531],[54509668,54509759],[54509847,54509985],[54511802,54511851],[54511948,54512105],[54516238,54516295],[54516895,54516992],[54517532,54517642],[54517805,54517938],[54518650,54518732],[54518913,54518972],[54519186,54519332],[54520693,54520826],[54521118,54521238],[54523393,54523539],[54523824,54523956],[54526527,54526746],[54528246,54528377],[54531259,54531357],[54531490,54531584],[54531742,54531825],[54532169,54532250],[54535103,54535197],[54536128,54536245],[54536943,54537053],[54538883,54538973],[54542574,54548243]]}]},{"name":"ENSG00000257824","strand":"-","start":54543110,"end":54544105,"transcripts":[{"id":"ENST00000547942","exons":[[54543110,54543568],[54543986,54544105]]}]},{"name":"PDE1B","strand":"+","start":54549550,"end":54579241,"transcripts":[{"id":"ENST00000243052","exons":[[54549600,54549772],[54549859,54549985],[54566973,54567087],[54569183,54569366],[54569545,54569612],[54570240,54570357],[54572600,54572741],[54573147,54573248],[54573354,54573480],[54573607,54573709],[54575097,54575218],[54575550,54575632],[54575991,54576100],[54576570,54576701],[54577224,54577345],[54577859,54579239]]},{"id":"ENST00000857306","exons":[[54549600,54549768],[54549859,54549985],[54566973,54567087],[54569183,54569366],[54569545,54569612],[54570240,54570357],[54572600,54572741],[54573147,54573248],[54573354,54573480],[54573607,54573709],[54575097,54575218],[54575550,54575632],[54575991,54576100],[54576570,54576701],[54577224,54577345],[54577859,54579241]]}]},{"name":"ENSG00000310050","strand":"-","start":54568542,"end":54569303,"transcripts":[{"id":"ENST00000846764","exons":[[54568542,54568792],[54569143,54569303]]}]},{"name":"PPP1R1A","strand":"-","start":54575386,"end":54588844,"transcripts":[{"id":"ENST00000988873","exons":[[54575394,54577542],[54580375,54580392],[54580943,54581050],[54581975,54582131],[54582731,54582795],[54583210,54583248],[54584259,54584320],[54588404,54588844]]},{"id":"ENST00000257905","exons":[[54579245,54580392],[54580943,54581050],[54581975,54582131],[54582731,54582795],[54583210,54583248],[54584259,54584320],[54588404,54588659]]}]},{"name":"GLYCAM1","strand":"-","start":54608186,"end":54610462,"transcripts":[{"id":"ENST00000550226","exons":[[54608186,54608411],[54608618,54608846],[54609632,54609677],[54610179,54610462]]},{"id":"ENST00000552698","exons":[[54608232,54608411],[54608652,54608846],[54609632,54609677],[54610179,54610429]]}]},{"name":"LACRT","strand":"-","start":54630810,"end":54634895,"transcripts":[{"id":"ENST00000547511","exons":[[54630810,54630953],[54631737,54631806],[54632240,54632381],[54633179,54633233],[54634783,54634895]]},{"id":"ENST00000257867","exons":[[54630810,54630953],[54631737,54631839],[54632240,54632381],[54633179,54633233],[54634783,54634895]]}]},{"name":"DCD","strand":"-","start":54644588,"end":54648493,"transcripts":[{"id":"ENST00000456047","exons":[[54644588,54644756],[54644883,54644947],[54645172,54645262],[54645605,54645707],[54647120,54647159],[54648245,54648493]]},{"id":"ENST00000293371","exons":[[54644588,54644756],[54645172,54645262],[54645605,54645707],[54647120,54647159],[54648245,54648365]]}]},{"name":"ENSG00000257634","strand":"+","start":54682972,"end":54687434,"transcripts":[{"id":"ENST00000552524","exons":[[54682972,54683112],[54685068,54685273],[54687079,54687434]]}]},{"name":"ENSG00000304866","strand":"+","start":54744128,"end":54771119,"transcripts":[]},{"name":"ENSG00000304888","strand":"-","start":54748880,"end":54750266,"transcripts":[{"id":"ENST00000806966","exons":[[54748880,54749160],[54749243,54749383],[54750080,54750266]]},{"id":"ENST00000806967","exons":[[54748994,54749160],[54749243,54749359]]}]},{"name":"MUCL1","strand":"+","start":54830517,"end":54896008,"transcripts":[]},{"name":"TESPA1","strand":"-","start":54948014,"end":54989104,"transcripts":[]},{"name":"ENSG00000299252","strand":"-","start":54984780,"end":54985152,"transcripts":[]},{"name":"ENSG00000299236","strand":"+","start":54984798,"end":55004838,"transcripts":[]},{"name":"ENSG00000257870","strand":"+","start":55009564,"end":55014247,"transcripts":[]},{"name":"NEUROD4","strand":"+","start":55019967,"end":55030017,"transcripts":[]},{"name":"ENSG00000301788","strand":"-","start":55023300,"end":55049820,"transcripts":[]}]}