{"schemaVersion":"1.1.0","locus":"wnt7b","interval":{"chromosome":"chr22","start":45444969,"end":46493545},"provenance":{"source":"atlas-api","clientVersion":"0.9.0","pipelineVersion":"0.1.0","queriedAt":"2026-09-12T19:26:02Z","configHash":"0615c9342b00e4a2","calibrationEpoch":"quantiles>=2026-06-18,indels>=2026-07-14","notes":"Genes y exones de Ensembl REST, GRCh38. No es una prediccion."},"genes":[{"name":"ENSG00000232363","strand":"-","start":45435691,"end":45448743,"transcripts":[]},{"name":"FBLN1","strand":"+","start":45502237,"end":45601981,"transcripts":[]},{"name":"LINC01589","strand":"-","start":45604412,"end":45639173,"transcripts":[]},{"name":"RNU6-1161P","strand":"-","start":45624530,"end":45624632,"transcripts":[]},{"name":"ENSG00000307862","strand":"+","start":45639638,"end":45656759,"transcripts":[]},{"name":"ENSG00000280383","strand":"+","start":45657018,"end":45680130,"transcripts":[]},{"name":"ATXN10","strand":"+","start":45671709,"end":45856028,"transcripts":[]},{"name":"MIR4762","strand":"+","start":45760523,"end":45760598,"transcripts":[]},{"name":"ENSG00000294602","strand":"+","start":45864599,"end":45865179,"transcripts":[]},{"name":"ENSG00000279954","strand":"+","start":45875931,"end":45894416,"transcripts":[{"id":"ENST00000779507","exons":[[45878914,45879166],[45883814,45883928],[45884106,45884401],[45885111,45885157],[45885337,45885472],[45885975,45886085],[45893830,45894052]]},{"id":"ENST00000779506","exons":[[45878883,45879166],[45883814,45883928],[45884106,45884401],[45885111,45885157],[45885975,45886085],[45893830,45894416]]}]},{"name":"ENSG00000235091","strand":"-","start":45875966,"end":45891465,"transcripts":[{"id":"ENST00000650444","exons":[[45876127,45876541],[45877213,45877360],[45879090,45879204],[45891404,45891438]]},{"id":"ENST00000451118","exons":[[45875998,45876541],[45879090,45879249],[45887645,45887748]]}]},{"name":"ENSG00000297345","strand":"-","start":45909554,"end":45911792,"transcripts":[{"id":"ENST00000747206","exons":[[45909554,45909960],[45910526,45910615],[45911704,45911792]]}]},{"name":"WNT7B","strand":"-","start":45920365,"end":45977260,"transcripts":[{"id":"ENST00000339464","exons":[[45920365,45923335],[45931097,45931369],[45949919,45950146],[45976683,45977162]]},{"id":"ENST00000409496","exons":[[45920365,45923335],[45931097,45931369],[45949919,45950146],[45972154,45972715]]}]},{"name":"ENSG00000293884","strand":"-","start":46010950,"end":46014320,"transcripts":[{"id":"ENST00000719617","exons":[[46011048,46011326],[46012030,46012269],[46013148,46013482],[46014136,46014304]]},{"id":"ENST00000719618","exons":[[46010950,46011326],[46012030,46012253],[46013083,46014003]]}]},{"name":"ENSG00000273145","strand":"+","start":46013239,"end":46015503,"transcripts":[{"id":"ENST00000608290","exons":[[46013568,46013810],[46014496,46015503]]},{"id":"ENST00000719714","exons":[[46013239,46013619],[46014496,46015503]]}]},{"name":"ENSG00000300548","strand":"-","start":46020768,"end":46028081,"transcripts":[{"id":"ENST00000772662","exons":[[46020768,46022192],[46027884,46028081]]}]},{"name":"ENSG00000303445","strand":"+","start":46036103,"end":46041098,"transcripts":[{"id":"ENST00000794653","exons":[[46036122,46036213],[46038623,46038837],[46040459,46040540],[46040845,46041092]]},{"id":"ENST00000794652","exons":[[46036103,46036213],[46040459,46040540],[46040845,46041092]]}]},{"name":"LINC00899","strand":"-","start":46039906,"end":46048412,"transcripts":[{"id":"ENST00000717662","exons":[[46040322,46040546],[46040754,46041052],[46042573,46042640],[46043562,46043699],[46044394,46044608],[46045947,46046073]]},{"id":"ENST00000717661","exons":[[46040322,46041052],[46042573,46042640],[46043562,46043699],[46044479,46044608],[46045803,46045853]]}]},{"name":"MIRLET7BHG","strand":"+","start":46044912,"end":46116382,"transcripts":[]},{"name":"PRR34","strand":"-","start":46049477,"end":46054144,"transcripts":[{"id":"ENST00000649288","exons":[[46049477,46051899],[46053749,46054144]]}]},{"name":"ENSG00000231010","strand":"-","start":46055739,"end":46058160,"transcripts":[{"id":"ENST00000439423","exons":[[46055739,46056515],[46057755,46058160]]}]},{"name":"ENSG00000303537","strand":"+","start":46062900,"end":46063814,"transcripts":[{"id":"ENST00000795383","exons":[[46062900,46062978],[46063110,46063234],[46063614,46063814]]}]},{"name":"LINC02939","strand":"-","start":46067060,"end":46071539,"transcripts":[]},{"name":"ENSG00000289044","strand":"+","start":46069751,"end":46070807,"transcripts":[]},{"name":"ENSG00000303516","strand":"-","start":46080556,"end":46081995,"transcripts":[]},{"name":"ENSG00000303492","strand":"-","start":46083503,"end":46085878,"transcripts":[]},{"name":"MIR3619","strand":"+","start":46091043,"end":46091126,"transcripts":[]},{"name":"MIRLET7A3","strand":"+","start":46112748,"end":46112822,"transcripts":[]},{"name":"MIR4763","strand":"+","start":46113565,"end":46113657,"transcripts":[]},{"name":"MIRLET7B","strand":"+","start":46113685,"end":46113768,"transcripts":[]},{"name":"ENSG00000310052","strand":"+","start":46129588,"end":46144031,"transcripts":[]},{"name":"ENSG00000310037","strand":"-","start":46134665,"end":46151394,"transcripts":[]},{"name":"PPARA","strand":"+","start":46149923,"end":46243755,"transcripts":[]},{"name":"ENSG00000310070","strand":"-","start":46161036,"end":46172233,"transcripts":[]},{"name":"ENSG00000280384","strand":"+","start":46163302,"end":46165347,"transcripts":[]},{"name":"CDPF1","strand":"-","start":46241404,"end":46250897,"transcripts":[]},{"name":"ENSG00000310243","strand":"+","start":46245906,"end":46255719,"transcripts":[]},{"name":"ENSG00000289858","strand":"+","start":46250384,"end":46252188,"transcripts":[]},{"name":"PKDREJ","strand":"-","start":46255662,"end":46263343,"transcripts":[]},{"name":"TTC38","strand":"+","start":46267960,"end":46295097,"transcripts":[]},{"name":"GTSE1-DT","strand":"-","start":46295142,"end":46296660,"transcripts":[]},{"name":"GTSE1","strand":"+","start":46296869,"end":46330810,"transcripts":[]},{"name":"TRMU","strand":"+","start":46330874,"end":46357344,"transcripts":[]},{"name":"CELSR1","strand":"-","start":46360833,"end":46537638,"transcripts":[]},{"name":"ENSG00000297903","strand":"+","start":46376982,"end":46384775,"transcripts":[]}]}