{"schemaVersion":"1.1.0","locus":"rasgef1b","interval":{"chromosome":"chr4","start":81210712,"end":82259288},"provenance":{"source":"atlas-api","clientVersion":"0.9.0","pipelineVersion":"0.1.0","queriedAt":"2026-09-11T12:55:55Z","configHash":"1cfeeff273740206","calibrationEpoch":"quantiles>=2026-06-18,indels>=2026-07-14","notes":"Genes y exones de Ensembl REST, GRCh38. No es una prediccion."},"genes":[{"name":"PRKG2","strand":"-","start":81086452,"end":81217970,"transcripts":[]},{"name":"ENSG00000303498","strand":"+","start":81214530,"end":81216430,"transcripts":[{"id":"ENST00000794995","exons":[[81214530,81214958],[81215564,81216430]]},{"id":"ENST00000794996","exons":[[81214702,81215056],[81215564,81216380]]}]},{"name":"RNU5A-2P","strand":"+","start":81334302,"end":81334418,"transcripts":[{"id":"ENST00000384337","exons":[[81334302,81334418]]}]},{"name":"RASGEF1B","strand":"-","start":81426392,"end":82044244,"transcripts":[{"id":"ENST00000638048","exons":[[81427064,81427792],[81432298,81432371],[81433839,81433963],[81434638,81434734],[81440833,81440929],[81442296,81442376],[81445525,81445628],[81445742,81445838],[81447503,81447578],[81448068,81448284],[81456650,81456788],[81457498,81457621],[81459331,81459514],[81602838,81602922],[81824517,81824571],[81915310,81915358],[82044000,82044069]]},{"id":"ENST00000509081","exons":[[81426392,81427792],[81432298,81432371],[81433839,81433963],[81434638,81434734],[81440833,81440929],[81442296,81442376],[81445525,81445628],[81445742,81445838],[81447503,81447578],[81448068,81448281],[81456650,81456788],[81457498,81457621],[81459331,81459514],[81471020,81471236]]}]},{"name":"RNU6-499P","strand":"+","start":82174546,"end":82174653,"transcripts":[{"id":"ENST00000365615","exons":[[82174546,82174653]]}]},{"name":"ENSG00000305474","strand":"-","start":82243872,"end":82285304,"transcripts":[{"id":"ENST00000811209","exons":[[82243879,82244184],[82246814,82246933],[82256407,82256499],[82285127,82285196]]},{"id":"ENST00000811208","exons":[[82243883,82244184],[82246814,82246933],[82283855,82283955],[82285127,82285252]]}]}]}