{"schemaVersion":"1.1.0","locus":"nags","interval":{"chromosome":"chr17","start":43477312,"end":44525888},"provenance":{"source":"atlas-api","clientVersion":"0.9.0","pipelineVersion":"0.1.0","queriedAt":"2026-09-12T19:30:54Z","configHash":"64ed23929aad2a9f","calibrationEpoch":"quantiles>=2026-06-18,indels>=2026-07-14","notes":"Genes y exones de Ensembl REST, GRCh38. No es una prediccion."},"genes":[{"name":"ENSG00000299460","strand":"+","start":43475995,"end":43481798,"transcripts":[]},{"name":"DHX8","strand":"+","start":43483864,"end":43610338,"transcripts":[]},{"name":"ETV4","strand":"-","start":43527840,"end":43579620,"transcripts":[]},{"name":"ENSG00000297964","strand":"+","start":43589339,"end":43614195,"transcripts":[]},{"name":"MEOX1","strand":"-","start":43640071,"end":43661929,"transcripts":[]},{"name":"ENSG00000305227","strand":"+","start":43669232,"end":43674457,"transcripts":[]},{"name":"ENSG00000305211","strand":"-","start":43671164,"end":43690795,"transcripts":[]},{"name":"LINC02594","strand":"+","start":43679340,"end":43706709,"transcripts":[]},{"name":"ENSG00000297747","strand":"-","start":43697867,"end":43701645,"transcripts":[]},{"name":"ENSG00000294500","strand":"+","start":43719889,"end":43720715,"transcripts":[]},{"name":"SOST","strand":"-","start":43753737,"end":43758791,"transcripts":[]},{"name":"DUSP3","strand":"-","start":43763628,"end":43779000,"transcripts":[]},{"name":"CFAP97D1","strand":"+","start":43780425,"end":43787620,"transcripts":[]},{"name":"CFAP97D1-AS1","strand":"-","start":43782803,"end":43784682,"transcripts":[]},{"name":"MPP3","strand":"-","start":43800794,"end":43833203,"transcripts":[]},{"name":"ENSG00000302186","strand":"+","start":43833661,"end":43846670,"transcripts":[]},{"name":"CD300LG","strand":"+","start":43847113,"end":43863639,"transcripts":[]},{"name":"MPP2","strand":"-","start":43875351,"end":43909711,"transcripts":[]},{"name":"ENSG00000282199","strand":"-","start":43914373,"end":43923001,"transcripts":[{"id":"ENST00000585329","exons":[[43914432,43914770],[43916742,43916841],[43920417,43920479],[43922775,43923001]]},{"id":"ENST00000768222","exons":[[43914433,43914770],[43917137,43917198],[43917292,43917426]]}]},{"name":"FAM215A","strand":"+","start":43917193,"end":43921042,"transcripts":[{"id":"ENST00000632077","exons":[[43917193,43918401],[43919233,43919499],[43920771,43921042]]},{"id":"ENST00000588043","exons":[[43917208,43917963]]}]},{"name":"LINC01976","strand":"+","start":43926844,"end":43950464,"transcripts":[{"id":"ENST00000741240","exons":[[43926994,43927123],[43929794,43929967],[43932472,43932702],[43934181,43934252],[43938227,43938397],[43938560,43938710],[43938847,43938963]]},{"id":"ENST00000565120","exons":[[43926844,43927123],[43929794,43929967],[43932472,43932702],[43934181,43934252],[43938227,43938397],[43938560,43938967]]}]},{"name":"ENSG00000296728","strand":"-","start":43927434,"end":43928459,"transcripts":[{"id":"ENST00000741351","exons":[[43927434,43927803],[43928254,43928459]]}]},{"name":"PPY","strand":"-","start":43940803,"end":43952444,"transcripts":[{"id":"ENST00001104516","exons":[[43940803,43940952],[43941142,43941214],[43941463,43941654],[43950139,43950204],[43952238,43952444]]},{"id":"ENST00000225992","exons":[[43940803,43940952],[43941142,43941214],[43941463,43941654],[43942420,43942476]]}]},{"name":"PYY","strand":"-","start":43952732,"end":44004469,"transcripts":[{"id":"ENST00000360085","exons":[[43952732,43952980],[43953108,43953189],[43953295,43953483],[43953849,43953975],[43957937,43958028],[43966287,43966532],[44004390,44004469]]},{"id":"ENST00000917562","exons":[[43952732,43952980],[43953114,43953189],[43953295,43953483],[43953849,43953975],[43957937,43958028],[43966287,43966532],[44004390,44004469]]}]},{"name":"NAGS","strand":"+","start":44004580,"end":44011213,"transcripts":[{"id":"ENST00000293404","exons":[[44004621,44005089],[44005636,44005911],[44006023,44006237],[44006528,44006709],[44007322,44007494],[44007590,44007773],[44008447,44009068]]},{"id":"ENST00000589767","exons":[[44004756,44005089],[44005636,44005911],[44006023,44006237],[44006528,44006709],[44007322,44007494],[44007566,44007773],[44008447,44009060]]}]},{"name":"TMEM101","strand":"-","start":44008985,"end":44023946,"transcripts":[{"id":"ENST00000589334","exons":[[44008985,44012236],[44013008,44013155],[44014356,44014537],[44014815,44015155],[44023038,44023221]]},{"id":"ENST00000585950","exons":[[44013008,44013155],[44014356,44014537],[44014983,44015155],[44021321,44021435],[44023038,44023106]]}]},{"name":"ENSG00000305936","strand":"+","start":44014417,"end":44019706,"transcripts":[{"id":"ENST00000814191","exons":[[44014417,44014512],[44019240,44019706]]}]},{"name":"U3","strand":"-","start":44025019,"end":44025223,"transcripts":[{"id":"ENST00000408117","exons":[[44025019,44025223]]}]},{"name":"LSM12","strand":"-","start":44033930,"end":44067619,"transcripts":[{"id":"ENST00000591247","exons":[[44033930,44036300],[44037411,44037538],[44040146,44040256],[44063800,44063934],[44066463,44066733],[44067442,44067619]]},{"id":"ENST00000585388","exons":[[44036142,44036300],[44036861,44037102],[44037411,44037538],[44040146,44040256],[44063800,44063934],[44066463,44066680]]}]},{"name":"G6PC3","strand":"+","start":44070619,"end":44094678,"transcripts":[{"id":"ENST00000696383","exons":[[44070619,44070714],[44071627,44071811],[44074159,44074266],[44074679,44074770],[44074968,44075087],[44075309,44075451],[44075679,44076319]]},{"id":"ENST00000696393","exons":[[44070729,44071183],[44074159,44074266],[44074679,44074770],[44074968,44075087],[44075309,44075451],[44075679,44075818],[44077196,44078104]]}]},{"name":"HDAC5","strand":"-","start":44076745,"end":44123702,"transcripts":[]},{"name":"ENSG00000267638","strand":"+","start":44115911,"end":44120595,"transcripts":[]},{"name":"ENSG00000300394","strand":"+","start":44123820,"end":44124419,"transcripts":[]},{"name":"RNU6-131P","strand":"-","start":44135882,"end":44135989,"transcripts":[]},{"name":"HROB","strand":"+","start":44141902,"end":44162481,"transcripts":[]},{"name":"ASB16-AS1","strand":"-","start":44157292,"end":44187180,"transcripts":[]},{"name":"ASB16","strand":"+","start":44170446,"end":44179373,"transcripts":[]},{"name":"ENSG00000298495","strand":"+","start":44181846,"end":44182358,"transcripts":[]},{"name":"ENSG00000298482","strand":"+","start":44185264,"end":44186728,"transcripts":[]},{"name":"TMUB2","strand":"+","start":44186954,"end":44191931,"transcripts":[]},{"name":"ATXN7L3","strand":"-","start":44191803,"end":44200961,"transcripts":[]},{"name":"ATXN7L3-AS1","strand":"+","start":44198519,"end":44234868,"transcripts":[]},{"name":"UBTF","strand":"-","start":44205032,"end":44221626,"transcripts":[]},{"name":"MIR6782","strand":"-","start":44207770,"end":44207839,"transcripts":[]},{"name":"ENSG00000288877","strand":"-","start":44221629,"end":44222157,"transcripts":[]},{"name":"SLC4A1","strand":"-","start":44248389,"end":44268162,"transcripts":[]},{"name":"ENSG00000302447","strand":"-","start":44266141,"end":44266644,"transcripts":[]},{"name":"ENSG00000302132","strand":"+","start":44268364,"end":44268947,"transcripts":[]},{"name":"ENSG00000285486","strand":"-","start":44276367,"end":44281787,"transcripts":[]},{"name":"RUNDC3A-AS1","strand":"-","start":44299566,"end":44315515,"transcripts":[]},{"name":"U3","strand":"+","start":44303964,"end":44304203,"transcripts":[]},{"name":"RNU6-453P","strand":"+","start":44307087,"end":44307172,"transcripts":[]},{"name":"RUNDC3A","strand":"+","start":44307944,"end":44318675,"transcripts":[]},{"name":"SLC25A39","strand":"-","start":44316820,"end":44326639,"transcripts":[]},{"name":"ENSG00000288961","strand":"+","start":44324358,"end":44327576,"transcripts":[]},{"name":"ENSG00000267211","strand":"+","start":44328612,"end":44331462,"transcripts":[]},{"name":"GRN","strand":"+","start":44345107,"end":44353106,"transcripts":[]},{"name":"FAM171A2","strand":"-","start":44353214,"end":44363875,"transcripts":[]},{"name":"ITGA2B","strand":"-","start":44372176,"end":44389649,"transcripts":[]},{"name":"GPATCH8","strand":"-","start":44395280,"end":44503639,"transcripts":[]},{"name":"ENSG00000283045","strand":"-","start":44486152,"end":44486815,"transcripts":[]}]}