{"schemaVersion":"1.1.0","locus":"apoa1","interval":{"chromosome":"chr11","start":116313361,"end":117361937},"provenance":{"source":"atlas-api","clientVersion":"0.9.0","pipelineVersion":"0.1.0","queriedAt":"2026-09-12T20:39:12Z","configHash":"35dd8307c576447d","calibrationEpoch":"quantiles>=2026-06-18,indels>=2026-07-14","notes":"Genes y exones de Ensembl REST, GRCh38. No es una prediccion."},"genes":[{"name":"LINC02151","strand":"-","start":116320213,"end":116500654,"transcripts":[]},{"name":"ENSG00000306177","strand":"+","start":116346665,"end":116348725,"transcripts":[]},{"name":"ENSG00000306159","strand":"+","start":116391204,"end":116413126,"transcripts":[]},{"name":"ENSG00000306194","strand":"+","start":116421776,"end":116422948,"transcripts":[]},{"name":"ENSG00000294068","strand":"-","start":116633621,"end":116638606,"transcripts":[]},{"name":"LINC02702","strand":"+","start":116639421,"end":116658295,"transcripts":[]},{"name":"ENSG00000308823","strand":"+","start":116731225,"end":116766233,"transcripts":[]},{"name":"BUD13","strand":"-","start":116748169,"end":116773039,"transcripts":[{"id":"ENST00000978769","exons":[[116748169,116748575],[116756227,116756343],[116757145,116757227],[116757765,116757950],[116758268,116758407],[116759073,116759179],[116760734,116760952],[116762552,116763266],[116765361,116765446],[116770128,116770222],[116772821,116773039]]},{"id":"ENST00000375445","exons":[[116748169,116748575],[116757145,116757227],[116757765,116757950],[116758268,116758407],[116759073,116759179],[116760734,116760952],[116762954,116763266],[116765361,116765446],[116770128,116770222],[116772821,116773039]]}]},{"name":"BUD13-DT","strand":"+","start":116773388,"end":116774205,"transcripts":[{"id":"ENST00000439104","exons":[[116773388,116773511],[116773909,116774205]]}]},{"name":"ZPR1","strand":"-","start":116773798,"end":116788477,"transcripts":[{"id":"ENST00000227322","exons":[[116773798,116779059],[116779771,116779837],[116782157,116782244],[116782918,116783029],[116783529,116783619],[116784377,116784448],[116784854,116784921],[116785098,116785146],[116785513,116785636],[116785795,116785882],[116786510,116786581],[116786968,116787059],[116787481,116787643],[116787819,116788023]]},{"id":"ENST00000900046","exons":[[116773798,116779059],[116779771,116779837],[116782157,116782244],[116782918,116783029],[116783529,116783619],[116784377,116784448],[116784854,116784921],[116785098,116785146],[116785513,116785636],[116785795,116785882],[116786510,116786581],[116786968,116787059],[116787481,116787643],[116787789,116788029]]}]},{"name":"APOA5","strand":"-","start":116789013,"end":116793026,"transcripts":[{"id":"ENST00000542499","exons":[[116789366,116791067],[116791585,116791697],[116791811,116791892],[116792379,116792641]]},{"id":"ENST00000433069","exons":[[116789366,116791067],[116791585,116791697],[116791811,116791868],[116792379,116792641]]}]},{"name":"LNC-RHL1","strand":"-","start":116812838,"end":116814147,"transcripts":[{"id":"ENST00000457746","exons":[[116812838,116813448],[116813915,116814147]]},{"id":"ENST00000814262","exons":[[116812839,116813453],[116813915,116814101]]}]},{"name":"ENSG00000305923","strand":"+","start":116813153,"end":116828501,"transcripts":[{"id":"ENST00000814128","exons":[[116813209,116813270],[116813353,116813422],[116813908,116814587]]},{"id":"ENST00000814126","exons":[[116814205,116814340],[116828164,116828501]]}]},{"name":"ENSG00000285513","strand":"+","start":116820644,"end":116821541,"transcripts":[{"id":"ENST00000645414","exons":[[116820644,116820812],[116821019,116821541]]}]},{"name":"APOA4","strand":"-","start":116820699,"end":116823427,"transcripts":[{"id":"ENST00000357780","exons":[[116820699,116821881],[116822658,116822785],[116823142,116823304]]},{"id":"ENST00001095767","exons":[[116820699,116821881],[116822658,116822782],[116823142,116823427]]}]},{"name":"APOC3","strand":"+","start":116827018,"end":116835254,"transcripts":[{"id":"ENST00000863786","exons":[[116827018,116827204],[116828716,116829085],[116830569,116830637],[116830772,116830896],[116832763,116833070]]},{"id":"ENST00000863788","exons":[[116828661,116829085],[116830197,116830332],[116830569,116830637],[116830772,116830896],[116832763,116833067]]}]},{"name":"APOA1","strand":"-","start":116834676,"end":116842065,"transcripts":[{"id":"ENST00001108737","exons":[[116834676,116834940],[116835861,116836411],[116837000,116837157],[116837344,116837407],[116837604,116837758]]},{"id":"ENST00000375320","exons":[[116835750,116836411],[116837000,116837157],[116837344,116837407],[116837527,116837622]]}]},{"name":"APOA1-AS","strand":"+","start":116836116,"end":116856210,"transcripts":[{"id":"ENST00000669664","exons":[[116836165,116836239],[116853869,116854022],[116855289,116856018]]},{"id":"ENST00000444200","exons":[[116836116,116836239],[116855289,116856210]]}]},{"name":"SIK3","strand":"-","start":116843401,"end":117098463,"transcripts":[]},{"name":"ENSG00000296731","strand":"+","start":116874632,"end":116895648,"transcripts":[{"id":"ENST00000741400","exons":[[116874635,116874815],[116875583,116875759],[116876975,116877076],[116878800,116878851],[116895404,116895648]]},{"id":"ENST00000741401","exons":[[116874632,116874815],[116876975,116877076],[116878800,116878851],[116895404,116895645]]}]},{"name":"ENSG00000224077","strand":"+","start":117098610,"end":117124209,"transcripts":[]},{"name":"ENSG00000307802","strand":"-","start":117137118,"end":117144733,"transcripts":[]},{"name":"ENSG00000307825","strand":"+","start":117137427,"end":117144193,"transcripts":[]},{"name":"PAFAH1B2","strand":"+","start":117144277,"end":117176894,"transcripts":[]},{"name":"SIDT2","strand":"+","start":117178729,"end":117197452,"transcripts":[]},{"name":"ENSG00000304501","strand":"-","start":117195611,"end":117200028,"transcripts":[]},{"name":"TAGLN","strand":"+","start":117197508,"end":117207464,"transcripts":[]},{"name":"PCSK7","strand":"-","start":117202587,"end":117232628,"transcripts":[]},{"name":"RNF214","strand":"+","start":117232153,"end":117287429,"transcripts":[]},{"name":"BACE1","strand":"-","start":117285231,"end":117316291,"transcripts":[]},{"name":"BACE1-AS","strand":"+","start":117288452,"end":117293494,"transcripts":[]},{"name":"ENSG00000276505","strand":"-","start":117297004,"end":117297328,"transcripts":[]},{"name":"CEP164","strand":"+","start":117314556,"end":117413616,"transcripts":[]},{"name":"ENSG00000309210","strand":"+","start":117316313,"end":117316549,"transcripts":[]},{"name":"ENSG00000250699","strand":"-","start":117316361,"end":117328038,"transcripts":[]}]}